{
  "$schema": "https://json-schema.org/draft/2020-12/schema",
  "$id": "vv5_tech_detail_native_evidence.schema.json",
  "title": "Disabled VV5 Tech and Detail native evidence gate",
  "type": "object",
  "additionalProperties": false,
  "required": ["id", "game_id", "enabled", "catalog_hidden", "catalog_enabled", "publication_ready", "native_output", "status", "stock", "folder_evidence", "native_contract", "native_proof", "player_receipts", "composition"],
  "properties": {
    "id": {"const": "vv5_tech_detail_native_evidence_gate"}, "game_id": {"const": "vv5"},
    "enabled": {"const": false}, "catalog_hidden": {"const": true}, "catalog_enabled": {"const": false},
    "publication_ready": {"const": false}, "native_output": {"const": false},
    "status": {"const": "pending authenticated full-folder native evidence and player receipts"},
    "stock": {"$ref": "#/$defs/stock"}, "folder_evidence": {"$ref": "#/$defs/folder"},
    "native_contract": {"$ref": "#/$defs/contract"}, "native_proof": {"$ref": "#/$defs/proof"},
    "player_receipts": {"$ref": "#/$defs/receipts"}, "composition": {"$ref": "#/$defs/composition"}
  },
  "$defs": {
    "sha": {"type": "string", "pattern": "^[0-9A-F]{64}$"},
    "nullableSha": {"anyOf": [{"$ref": "#/$defs/sha"}, {"type": "null"}]},
    "nullableHex": {"anyOf": [{"type": "string", "pattern": "^(?:[0-9A-F]{2})+$"}, {"type": "null"}]},
    "nullableVa": {"anyOf": [{"type": "string", "pattern": "^0x[0-9A-F]+$"}, {"type": "null"}]},
    "stock": {"type": "object", "additionalProperties": false, "required": ["filename", "size", "sha256"], "properties": {"filename": {"const": "Virtual Villagers - New Believers.exe"}, "size": {"const": 991232}, "sha256": {"const": "92946781980220E9D1A2E6C573925519934608F5215F4A0F8CE3B90088C5C65D"}}},
    "folder": {"type": "object", "additionalProperties": false, "required": ["authenticated", "complete_folder_verified", "inventory_schema", "file_count", "total_size", "unexpected_files", "manifest_sha256", "authentication_receipt_sha256"], "properties": {"authenticated": {"type": "boolean"}, "complete_folder_verified": {"type": "boolean"}, "inventory_schema": {"const": "vvfp.full-folder-inventory.v1"}, "file_count": {"anyOf": [{"type": "integer", "minimum": 1}, {"type": "null"}]}, "total_size": {"anyOf": [{"type": "integer", "minimum": 1}, {"type": "null"}]}, "unexpected_files": {"type": "array", "items": {"type": "string", "minLength": 1}}, "manifest_sha256": {"$ref": "#/$defs/nullableSha"}, "authentication_receipt_sha256": {"$ref": "#/$defs/nullableSha"}}},
    "contract": {"type": "object", "additionalProperties": false, "required": ["resource", "dimensions", "local", "message", "event", "factory_va", "ownership_va", "tech_constructor_va", "tech_handler_va", "detail_draw_va", "detail_vtable_va", "detail_destructor_va", "detail_input_method_entry_va", "detail_input_method_entry_bytes", "detail_input_stack_locals", "detail_input_nonvolatile_saves", "detail_input_cleanup", "detail_event_method_va", "detail_event_method_entry_bytes", "detail_event_cleanup", "stock_xref_to_7B22C0", "stock_xref_to_7B2600", "candidate_route_va", "candidate_callsite_va", "rejected_candidate_window_flags_pointer_va", "authenticated_window_flags_string_va", "rejected_candidate_requested_symbol"], "properties": {"resource": {"const": "0x6A"}, "dimensions": {"const": [96, 39]}, "local": {"const": [137, 2]}, "message": {"const": 8}, "event": {"const": 13}, "factory_va": {"const": "0x401BD0"}, "ownership_va": {"const": "0x40C680"}, "tech_constructor_va": {"const": "0x4405F0"}, "tech_handler_va": {"const": "0x4415F0"}, "detail_draw_va": {"const": "0x44B250"}, "detail_vtable_va": {"const": "0x49A590"}, "detail_destructor_va": {"const": "0x44B9F0"}, "detail_input_method_entry_va": {"const": "0x44B560"}, "detail_input_method_entry_bytes": {"const": "83EC44535556BD7F03000057BF580300"}, "detail_input_stack_locals": {"const": "0x44"}, "detail_input_nonvolatile_saves": {"const": ["EBX", "EBP", "ESI", "EDI"]}, "detail_input_cleanup": {"const": "ret 0xC"}, "detail_event_method_va": {"const": "0x44BC20"}, "detail_event_method_entry_bytes": {"const": "83EC18A1A8974D00"}, "detail_event_cleanup": {"const": "ret 8"}, "stock_xref_to_7B22C0": {"const": false}, "stock_xref_to_7B2600": {"const": false}, "candidate_route_va": {"type": "null"}, "candidate_callsite_va": {"type": "null"}, "rejected_candidate_window_flags_pointer_va": {"const": "0x7B2A64"}, "authenticated_window_flags_string_va": {"const": "0x7B2A63"}, "rejected_candidate_requested_symbol": {"const": "DL_GetWindowFlags"}}},
    "proof": {"type": "object", "additionalProperties": false, "required": ["folder_manifest_sha256", "disassembly_artifact_sha256", "instruction_map_sha256", "lifecycle_trace_sha256", "overlap_report_sha256", "constructor_stock_bytes", "constructor_continuation_va", "handler_stock_bytes", "handler_continuation_va", "candidate_executable_sha256", "candidate_folder_manifest_sha256", "candidate_machine_export_sha256", "instruction_boundaries_verified", "thiscall_receiver_verified", "message_abi_verified", "register_stack_preservation_verified", "child_ownership_verified", "child_destructor_verified", "range_overlap_verified", "method_entry_rejected_as_callsite", "event_method_rejected_as_callsite"], "properties": {"folder_manifest_sha256": {"$ref": "#/$defs/nullableSha"}, "disassembly_artifact_sha256": {"$ref": "#/$defs/nullableSha"}, "instruction_map_sha256": {"$ref": "#/$defs/nullableSha"}, "lifecycle_trace_sha256": {"$ref": "#/$defs/nullableSha"}, "overlap_report_sha256": {"$ref": "#/$defs/nullableSha"}, "constructor_stock_bytes": {"$ref": "#/$defs/nullableHex"}, "constructor_continuation_va": {"$ref": "#/$defs/nullableVa"}, "handler_stock_bytes": {"$ref": "#/$defs/nullableHex"}, "handler_continuation_va": {"$ref": "#/$defs/nullableVa"}, "candidate_executable_sha256": {"$ref": "#/$defs/nullableSha"}, "candidate_folder_manifest_sha256": {"$ref": "#/$defs/nullableSha"}, "candidate_machine_export_sha256": {"$ref": "#/$defs/nullableSha"}, "instruction_boundaries_verified": {"type": "boolean"}, "thiscall_receiver_verified": {"type": "boolean"}, "message_abi_verified": {"type": "boolean"}, "register_stack_preservation_verified": {"type": "boolean"}, "child_ownership_verified": {"type": "boolean"}, "child_destructor_verified": {"type": "boolean"}, "range_overlap_verified": {"type": "boolean"}, "method_entry_rejected_as_callsite": {"const": true}, "event_method_rejected_as_callsite": {"const": true}}},
    "receipt": {"type": "object", "additionalProperties": false, "required": ["mode", "action", "stock_sha256", "folder_manifest_sha256", "click_reached", "dialog_visible", "owner_verified", "centered", "restore_verified", "receipt_sha256"], "properties": {"mode": {"enum": ["windowed", "fullscreen"]}, "action": {"enum": ["tech", "detail"]}, "stock_sha256": {"const": "92946781980220E9D1A2E6C573925519934608F5215F4A0F8CE3B90088C5C65D"}, "folder_manifest_sha256": {"$ref": "#/$defs/sha"}, "click_reached": {"const": true}, "dialog_visible": {"const": true}, "owner_verified": {"const": true}, "centered": {"const": true}, "restore_verified": {"const": true}, "receipt_sha256": {"$ref": "#/$defs/sha"}}},
    "nullableReceipt": {"anyOf": [{"$ref": "#/$defs/receipt"}, {"type": "null"}]},
    "receipts": {"type": "object", "additionalProperties": false, "required": ["tech_windowed", "tech_fullscreen", "detail_windowed", "detail_fullscreen"], "properties": {"tech_windowed": {"$ref": "#/$defs/nullableReceipt"}, "tech_fullscreen": {"$ref": "#/$defs/nullableReceipt"}, "detail_windowed": {"$ref": "#/$defs/nullableReceipt"}, "detail_fullscreen": {"$ref": "#/$defs/nullableReceipt"}}},
    "composition": {"type": "object", "additionalProperties": false, "required": ["full_mastery_range", "running_range", "ui_ranges", "full_heal_ranges", "candidate_hooks", "candidate_caves", "patches"], "properties": {"full_mastery_range": {"const": "0xF2000-0xF4000"}, "running_range": {"const": "0xF4000-0xF6000"}, "ui_ranges": {"const": []}, "full_heal_ranges": {"const": []}, "candidate_hooks": {"const": []}, "candidate_caves": {"const": []}, "patches": {"const": []}}}
  }
}
