{
  "id": "vv5_tech_detail_native_evidence_gate",
  "game_id": "vv5",
  "enabled": false,
  "catalog_hidden": true,
  "catalog_enabled": false,
  "publication_ready": false,
  "native_output": false,
  "status": "pending authenticated full-folder native evidence and player receipts",
  "stock": {
    "filename": "Virtual Villagers - New Believers.exe",
    "size": 991232,
    "sha256": "92946781980220E9D1A2E6C573925519934608F5215F4A0F8CE3B90088C5C65D"
  },
  "folder_evidence": {
    "authenticated": false,
    "complete_folder_verified": false,
    "inventory_schema": "vvfp.full-folder-inventory.v1",
    "file_count": null,
    "total_size": null,
    "unexpected_files": [],
    "manifest_sha256": null,
    "authentication_receipt_sha256": null
  },
  "native_contract": {
    "resource": "0x6A",
    "dimensions": [96, 39],
    "local": [137, 2],
    "message": 8,
    "event": 13,
    "factory_va": "0x401BD0",
    "ownership_va": "0x40C680",
    "tech_constructor_va": "0x4405F0",
    "tech_handler_va": "0x4415F0",
    "detail_draw_va": "0x44B250",
    "detail_vtable_va": "0x49A590",
    "detail_destructor_va": "0x44B9F0",
    "detail_input_method_entry_va": "0x44B560",
    "detail_input_method_entry_bytes": "83EC44535556BD7F03000057BF580300",
    "detail_input_stack_locals": "0x44",
    "detail_input_nonvolatile_saves": ["EBX", "EBP", "ESI", "EDI"],
    "detail_input_cleanup": "ret 0xC",
    "detail_event_method_va": "0x44BC20",
    "detail_event_method_entry_bytes": "83EC18A1A8974D00",
    "detail_event_cleanup": "ret 8",
    "stock_xref_to_7B22C0": false,
    "stock_xref_to_7B2600": false,
    "candidate_route_va": null,
    "candidate_callsite_va": null,
    "rejected_candidate_window_flags_pointer_va": "0x7B2A64",
    "authenticated_window_flags_string_va": "0x7B2A63",
    "rejected_candidate_requested_symbol": "DL_GetWindowFlags"
  },
  "native_proof": {
    "folder_manifest_sha256": null,
    "disassembly_artifact_sha256": null,
    "instruction_map_sha256": null,
    "lifecycle_trace_sha256": null,
    "overlap_report_sha256": null,
    "constructor_stock_bytes": null,
    "constructor_continuation_va": null,
    "handler_stock_bytes": null,
    "handler_continuation_va": null,
    "candidate_executable_sha256": null,
    "candidate_folder_manifest_sha256": null,
    "candidate_machine_export_sha256": null,
    "instruction_boundaries_verified": false,
    "thiscall_receiver_verified": false,
    "message_abi_verified": false,
    "register_stack_preservation_verified": false,
    "child_ownership_verified": false,
    "child_destructor_verified": false,
    "range_overlap_verified": false,
    "method_entry_rejected_as_callsite": true,
    "event_method_rejected_as_callsite": true
  },
  "player_receipts": {
    "tech_windowed": null,
    "tech_fullscreen": null,
    "detail_windowed": null,
    "detail_fullscreen": null
  },
  "composition": {
    "full_mastery_range": "0xF2000-0xF4000",
    "running_range": "0xF4000-0xF6000",
    "ui_ranges": [],
    "full_heal_ranges": [],
    "candidate_hooks": [],
    "candidate_caves": [],
    "patches": []
  }
}
